{
  "$schema": "https://json-schema.org/draft/2020-12/schema",
  "$id": "https://example.com/schemas/tenant-context.schema.v1.json",
  "title": "Tenant Context",
  "type": "object",
  "additionalProperties": false,
  "required": [
    "version",
    "tenant_id",
    "project_scope",
    "summary",
    "constraints"
  ],
  "properties": {
    "version": { "type": "string", "enum": ["v1"] },
    "tenant_id": { "type": "string", "minLength": 1 },
    "project_scope": { "type": "string", "minLength": 1 },
    "summary": { "type": "string", "minLength": 1 },
    "constraints": {
      "type": "array",
      "items": { "type": "string", "minLength": 1 },
      "minItems": 1
    }
  }
}
