{
  "version": "v1",
  "tenant_id": "TENANT-DEFAULT",
  "project_scope": "managed-repository",
  "summary": "Default tenant context for project management orchestration.",
  "constraints": [
    "Keep workspace-first operations.",
    "Keep core writes fail-closed by default.",
    "Keep evidence and status outputs machine-readable."
  ]
}
